{
  "contractVersion": 1,
  "id": "grouped-flow-sequence-diagrams",
  "summary": "Extends deterministic compile-time diagrams with layered flows, optional subsystem groups, connection kinds, legends, node detail lines, ordered call sequences, and a written-out diagram description.",
  "trustBoundary": {
    "authorCode": "forbidden",
    "callbacks": "forbidden",
    "eval": "forbidden",
    "dynamicImports": "forbidden",
    "networkAccess": "forbidden",
    "confinement": "source-root",
    "offline": "required",
    "deterministicSerialization": "required",
    "cspCompatible": "required",
    "packageOwnedRuntime": "required"
  },
  "evidence": {
    "sourceGrammar": "The registry owns flow and sequence forms, one-to-twenty flow nodes, up to forty flow edges, up to five non-empty groups around some nodes with other nodes beside them, auto/down/right/orthogonal default flow view (layout, with direction as its older spelling), four connection kinds, an optional node detail line, at most one legend and up to eight legend items, two-to-six sequence participants, and one-to-forty labelled ordered messages. Unknown identities, duplicates, empty groups, undeclared groups, sequence direction or layout, layout together with direction, a connection id equal to a node id, a zoom of an undeclared node, a pulse route along a missing connection, legend items naming none or several subjects, node legend items without a label, hidden items with a label, duplicate legend items, and bounds fail at authored directives; a connection to its own node is a step that repeats, drawn as a loop on a flow node's corner or on a sequence lifeline. Flow nodes take a done/review/returned/pending status, connections a «×N» count and an optional id, and one node may open into a nested zoom flow.",
    "executionCapabilities": "Validated records become package-owned deterministic SVG geometry after sanitization. Flow layers come from package code; node order, coordinates, clusters, and label places come from dagre for the two layered views and from ELK for the right-angle view, both at build time; sequences use authored participant and message order. No source string becomes executable syntax or a general graph program.",
    "confinement": "Groups, participants, nodes, edges, labels, and messages are ordinary bounded directive attributes and cause no filesystem lookup or resource resolution beyond the existing Markdown source graph.",
    "offlineBehavior": "Compilation and both file-URL output formats use local package code, the build-time dagre and ELK layout libraries, and CSS only. No visualization server, browser renderer, worker, font request, or network request is required, and no layout code ships to the browser.",
    "deterministicSerialization": "View boxes, layers, node positions, group boxes, routes, labels, legend entries, IDs, descriptions, and output bytes derive only from validated authored order and package constants; the layout candidates are tried in a fixed order and ties keep the earlier one. No clock, randomness, environment locale, viewport measurement, or runtime layout feeds serialization.",
    "cspAndRuntime": "The extension adds SVG elements, package classes, and a tab list that reuses the package tabs runtime to switch compile-time views; its only controller is the package-owned diagram-motion module, which moves already drawn geometry on the page clock (the drawing fallback without scroll timelines, the draw marker, route pulses and the zoom camera `viewBox`) and never lays anything out; there is no inline handler, author CSS, raw HTML, URL, eval, dynamic import, canvas, iframe, or CSP source. Print CSS shows only the author's default view. Existing page theme controls only package variables.",
    "accessibility": "Each diagram remains one labelled atomic image. Its description is written text: node and layer count, groups with members, layers in flow order, connections along the flow and backward connections separately in the legend's words, or every sequence participant and ordered message. The same text is repeated under the picture in a closed native disclosure. Visible node and connection labels wrap rather than truncate, and the description always carries the complete data.",
    "byteAndPerformanceBudgets": "Validation and layout are finite at registry-owned bounds; flow layout runs a fixed number of dagre candidates per layered view and one ELK layout at build time. Every flow ships three views, so its SVG bytes grow by that factor. Diagrams with draw, pulse or zoom add one shared scroll listener, one intersection observer per pulsing diagram and per-frame work bounded by their drawn connections, all on the page clock and absent under reduced motion; SVG and description bytes remain covered by compiler accounting and package checks.",
    "packageDependenciesAndLicenses": "Adds @dagrejs/dagre 3.1.1 and its dependency @dagrejs/graphlib 4.0.5, both MIT, and elkjs 0.12.0, dual-licensed EPL-2.0 or GPL-3.0 and used under EPL-2.0, all only at build time for flow layout; elkjs has no runtime dependencies. Charts, sequences, and timelines keep the project-owned registry, validator, HAST/SVG renderer, and CSS.",
    "compatibility": "Existing flow sources build unchanged within source-contract major 1 but are laid out by layers: direction defaults to auto, row is a flow-layer hint, route is a layout pull, and a single group or ungrouped nodes beside groups are ordinary flows without a warning. Sequence, theme, output-format, CLI, ESM, CSP, and review contracts are preserved; every unsupported shape fails instead of invoking a compatibility fallback."
  }
}
